{
  "schema_version": "phase9-candidate-matrix/1.1.0",
  "benchmark_version": "semantic-benchmark/1.1.0",
  "matrix_status": "UNSET",
  "authorization": "NONE",
  "qualification_thresholds": "UNSET",
  "promotion_ladder": ["SMOKE", "CORE", "HELD_OUT_CONFIRMATION"],
  "candidates": [
    {"stage": "P04", "candidate_id": "UNSET", "model": "UNSET", "model_snapshot": "UNSET", "reasoning_effort": "UNSET", "max_output_tokens": "UNSET", "per_call_cap_usd": "UNSET", "stage_cap_usd": "UNSET", "promotion_order": "UNSET"},
    {"stage": "P06", "candidate_id": "UNSET", "model": "UNSET", "model_snapshot": "UNSET", "reasoning_effort": "UNSET", "max_output_tokens": "UNSET", "per_call_cap_usd": "UNSET", "stage_cap_usd": "UNSET", "promotion_order": "UNSET"},
    {"stage": "P07", "candidate_id": "UNSET", "model": "UNSET", "model_snapshot": "UNSET", "reasoning_effort": "UNSET", "max_output_tokens": "UNSET", "per_call_cap_usd": "UNSET", "stage_cap_usd": "UNSET", "promotion_order": "UNSET"},
    {"stage": "P09", "candidate_id": "UNSET", "model": "UNSET", "model_snapshot": "UNSET", "reasoning_effort": "UNSET", "max_output_tokens": "UNSET", "per_call_cap_usd": "UNSET", "stage_cap_usd": "UNSET", "promotion_order": "UNSET"}
  ]
}
